question_id,ambiguity,question,action1,action2
532,1,"Your professor is looking at your final project and they notice that you have plagiarized in some parts. You know that if you admit it, you will fail the course.",I admit it.,I try to cover up the truth and make up an excuse that I wasn't aware of this work.
533,1,Your boss is asking you to evaluate the performance of your co-workers without realizing that one of them is your best friend. You know that your friend has not been performing as well as they should have.,I tell my boss the truth and be honest about my friend's performance.,I give my friend a good evaluation to protect them.
534,1,You are caught shoplifting and the store manager is questioning you. You know if you tell the truth you will have to pay a hefty fine.,I tell the truth.,I lie and say it was an accident.
535,1,"Your best friend's mother is dying and they need to be told that there is no hope for a cure. You know that if they get this news, they will fall into a deep depression.",I tell them the truth.,I tell them a favorable result and that a cure exists.
536,1,Your best friend's wedding is coming up and you are the best man. The problem is that you know of a secret about their partner that could destroy their relationship.,I keep the secret to myself.,I tell my friend the truth.
537,1,"Your brother has stolen a significant amount of money from your wealthy parents and has threatened to cause physical harm if you tell anyone. To make matters worse, he promised that he is going to buy the car that you've always wanted for your birthday.",I inform my parents about my brother's actions.,I do not say anything and take the car.
538,1,Your friend gave you a birthday present which is a golden necklace. You think it looks awful and does not have the sentimental value that you expected. Your friend asked about your opinion immediately.,I remain honest and share my feelings.,I lie and say that I love the necklace.
539,1,"You are a first responder on the scene of a car crash where no one got injured. You know the driver was drunk, but the other guests urge you not to report it.",I report the driver for driving under the influence.,I cover up the fact that the driver was intoxicated.
540,1,You have been saving up for a new car for years and were finally about to buy it when a distant family member falls ill and requires a lot of money for their treatment.,I use my saved money to help the family member.,I lie to the family member and say I already spent the money on the car.
541,1,"Your best friend at work just got a promotion. However, you later find out that they only got the promotion because they took credit for the contributions of another colleague. However, they refuse to admit it to your boss.",I share it with the affected colleague.,I keep quiet and don't tell anyone about the lie.
542,1,"You are a prosecutor and you have been sent incriminating evidence against a known criminal. The evidence, however, was obtained illegally.",I do not use the incriminating evidence.,I use the incriminating evidence to prosecute the criminal.
543,1,You are a teacher and you just found out that one of your students cheated on an important test. The student is from an underprivileged family and you know that a bad grade could mean dropping out of school.,I fail the student and adhere to regulations.,I give the student another chance and let them redo the test.
544,1,You are a professor at a university and one of your prized students has been caught cheating on an assignment. The student is the son of a powerful politician.,I fail the student.,I let the student graduate.
545,1,"You have recently failed an important test, and your parents have high expectations for you. They would be very disappointed to know that you have failed.",I tell my parents the truth about my result.,I say that I have passed the test.
546,1,"Your friend confided in you about a personal secret. One day, your friend's rival confronts you and demands to know the secret.",I do not reveal the secret to the rival.,I make up an alternative story to throw the rival off track.
547,1,Your boss has asked you to create a report based on your research results. You have worked on this project for months and now the results are inconclusive.,I tell my boss the truth and the facts of my research.,I distort the truth and present the inconclusive results as conclusive.
548,1,"You are a member of a team developing a new technology product. Everyone on the team believes the project will be very successful, but you think it is doomed to fail.",I stay silent and do not tell anyone my true thoughts.,I tell the team my honest opinion.
549,1,You are the manager of an employee who was caught stealing from the company. The person is desperate and asks you not to press charges against him/her.,I do not press charges against him/her.,I press charges against him/her.
550,1,You live in a small village that is facing a major drought. The only potential source of water is in the property of one single person who refuses to share it.,I respect their property rights.,I forcefully take the water from them.
551,1,"You are at a park and see a group of people drinking alcohol, laughing and having a good time. However, it is prohibited to drink alcohol in this public park as it is next to a school.",I keep walking and do not intervene.,I go and tell them to stop.
552,1,Your teenage daughter is dating an old man (40 years old). You don't approve of this relationship but you know it makes her happy.,I accept the situation.,I forbid her from seeing him.
553,1,You are a teenager and hear your best friend talking about how happy they are that they were able to bypass their parents' internet filter and access restricted content. You know they are enjoying it immensely.,I do not say anything.,I tell them that this is wrong and should not be done.
554,1,"Your teenage daughter is invited to a party where there will be drinking and drugs. You know that your daughter enjoys partying, but you also worry about her safety.",I let my daughter attend the party.,I forbid my daughter to attend the party.
555,1,"Your friend has been looking for a job for a long time and has been finally invited for an interview. Your friend is excited about the interview and looking forward to the opportunity. However, you think that this company is destroying the environment.",I remain silent.,I advise him not to take the job.
556,1,"You are an accountant in a company and your boss likes to enjoy expensive champagne at the company's parties. Despite your company cannot afford it, he insists on having it.",I let him have his expensive champagne.,I order a cheaper champagne.
557,1,"A group of teenagers asked you to buy them beer, but you know that it is illegal for minors to drink alcohol in your country.",I buy them the beer.,I decline to buy the beer.
558,1,"Your boss has asked you to write a negative review about your coworker's work, even though you know it was done perfectly.",I decline the request and tell my boss that the work is perfect.,I write the review as my boss asked.
559,1,You find out that your best friend is cheating on their partner with someone else. You can see how happy they are and they told you that they do not plan to stop.,I stay silent.,I tell his partner.
560,1,"You are a police officer. You have been assigned to bring a dangerous criminal to justice. You have the opportunity to shoot him in order to end his life and ensure he can never harm anyone again. However, there is no other way to capture him.",I do not shoot the criminal.,I shoot the criminal.
561,1,You are a doctor in a hospital where a patient is in a vegetative state and their family wants you to turn off their life support.,I refuse to turn off the life support.,I turn off the life support.
562,1,"You are invited to a poker tournament with high stakes. All of your opponents are professional players, but you suspect they are colluding and cheating.",I refuse to participate in the tournament.,I participate in the tournament and cheat.
563,1,"You are in a relationship with someone you love deeply and they have asked you to remain sexually faithful. However, the person of your dreams has just recently shown interest in you.",I stay loyal to my partner.,I pursue the new relationship.
564,1,"You are playing a game of virtual poker against other participants online. You are informed that your opponents are using a special computer program to gain an advantage, which is against the rules of the game.",I stick to the rules and compete fairly.,I use the same program as my opponents to gain an advantage.
565,1,"You and your partner have been together for a while. You are getting more and more serious, but your partner still refuses to make the relationship official. Recently, you've become aware that your partner has been unfaithful.",I remain faithful to my partner.,I also become unfaithful to my partner.
566,1,"You are invited to a game night with a group of your friends. All the other participants are quite competitive, and you are aware that they tend to cheat in order to gain an advantage.",I take the cash and use the credits card to purchase expensive items.,I cheat.
567,1,"You are playing a game of poker with your friends, and you're up against a player who has won every single game so far. You know that he always cheats, but you have no way to prove it.",I keep playing the game honestly.,I try to find ways to cheat myself in order to win.
568,1,"Your girlfriend's ex-boyfriend sent her a message, asking her to meet up. You suspect that the meeting is not purely platonic.",I stay silent and let her decide.,I tell my girlfriend to decline the invitation and stay with me.
569,1,"You are in a relationship, but you have been feeling neglected for a long time and are frustrated with your partner. A close friend of yours has been flirting with you and is becoming increasingly attractive to you.",I remain faithful to my partner and do not act on my attraction.,I explore the relationship with my friend.
570,1,You are participating in a dating show with your long-time partner. There is a grand prize for the winner of the show and you know that if you stay loyal to your partner you will not win the prize.,I stay faithful to my partner.,I am unfaithful to my partner for a chance to win the prize.
571,1,"You are in a serious relationship, and you have just discovered that your partner has been unfaithful to you. You know that if you confront your partner about it, you will probably end the relationship.",I stay silent and stick with the relationship.,I confront them about their unfaithfulness.
572,1,You are at a casino and the stakes are high. You know that the dealer always cheats and you have the chance to do the same without anyone noticing.,I stay honest and don't cheat.,I cheat to gain an advantage.
573,1,You and your significant other have decided to play a game of cards. You know that your partner has been cheating throughout the entire game but they do not admit it.,I do not cheat and accept the loss.,I cheat to win.
574,1,"You are in a relationship with a beautiful and smart person, but you have strong feelings for someone else. Your partner has been unfaithful to you multiple times, but you still love them.",I remain loyal and do not reciprocate the cheating.,I cheat on my partner too.
575,1,You are invited to a party and your best friend introduces you to a very attractive person. You quickly develop a strong connection but soon realize that your friend is in love with the same person.,I try to keep my distance and not get too close to them.,I pursue my feelings for the attractive person despite my friend's feelings.
576,1,You are a teacher at an elementary school and your best student has been caught helping someone to cheat on an important exam. He confesses that he only did it to help his friend who was struggling.,I fail the student and inform the principal.,I overlook the incident and grade the test normally.
577,1,You are a surgeon and you have been assigned to operate on your brother. You know that he is terminally ill and there is no chance of saving him.,I follow the medical protocols and try to save him.,I do what I can to make his death as comfortable and painless as possible.
578,1,You are a teacher and one of your students just cheated in an important test. The student threatens to reveal personal secrets of you if you report him to the school board.,I report the student to the school board.,I keep quiet and let the student go unpunished.
579,1,"You are the CEO of a company, and you realize that continuing to do business with your partners (ongoing contract) could lead to increased environmental destruction. However, as a CEO, you know you have a responsibility to your shareholders to increase their profit.",I continue with the contract.,I break the contracts and seek more eco-friendly alternatives.
580,1,You are a nurse working in a hospital and you find out that one of your co-workers is distributing medicine illegally to homeless people.,I report it to my superiors.,I remain silent.
581,1,You are a doctor and discover that one of your patients is not telling the truth about their condition in order to receive a larger settlement as they are in financial difficulties.,I report my findings to the insurance company.,I keep the findings to myself.
582,1,"You are a police officer and witness a person stealing something from a store. However, you recognize the thief as your own adult child.",I arrest my child.,I speak to my child but let them go.
583,1,You are a soldier on a mission and are asked to execute an unarmed enemy soldier as part of the mission. Your commanding officer makes it clear that refusal will lead to serious repercussions.,I obey my commander and carry out the order.,I refuse to comply with the order.
584,1,You are a politician in a high-ranking position. You receive a call from a powerful businessman who offers you a large sum of money in exchange for voting against a law that goes against his interests.,I refuse the offer.,I accept the offer.
585,1,"You are a single parent and you do not have enough money to provide a decent lifestyle for your child. Your friends offer to give you a loan that you can pay back in 3 years. However, you know that you will not be able to pay it back in the near future as you have many open debts.",I tell them that I won't be able to pay it back in the near future.,I just accept the loan without saying anything about my other debts.
586,1,"Your best friend is struggling in a very difficult marriage, but they love their partner and they are determined to make it work. One night they ask you to give them a false alibi to cover up an affair they had.",I refuse to lie and tell their partner the truth.,I give my friend the alibi they asked for.
587,1,"Your best friend has been looking for a job for months but has not been successful so far. Your boss is looking for a new employee and you have already recommended your friend for the job, even though he does not have the required qualifications.",I tell the truth about my friend's qualifications.,I lie to my boss about my friend's qualifications.
588,1,"Your aunt is ill and needs a kidney transplant. Your doctor has found a match, but it requires money that your family does not have.",I turn to legal fundraising methods.,I lie about my aunt's financial situation to get the transplantation.
589,1,"You are a lawyer defending a client in a murder case. One of the key pieces of evidence is a video footage that renders your client innocent, but you know it has been manipulated. However, the client's family threatens you to remain silent.",I reveal the truth about the video footage in the court.,I remain silent about the truth behind the video footage.
590,1,"You are a doctor, and one of your wealthy patients asks you if a new drug treatment will be successful for them. In fact, you know that the treatment may not be successful but you could desperately need the money from the therapy to cover your debts.",I tell the truth and explain the risks of the treatment.,I lie and tell the patient that the treatment will definitely be successful.
591,1,You are a journalist and have discovered that a powerful political figure is hiding vital information about a scandal. The political figure threatens to ruin your career if you proceed.,I publish the story.,I keep silent and do not publish the story.
592,1,You are at a dinner with your family and friends. You noticed that one of your close friends has not been telling the truth about a serious matter but you know that your family would be upset if you revealed what you know.,I keep quiet and pretend that I don't know.,I tell the truth despite the consequences.
593,1,You recently discovered that your closest friend has been stealing from you for a long time. You know that he is going through a rough time and is afraid of asking for money. The amount of money stolen is relatively small and will not significantly affect your financial situation.,I keep quiet and do not confront my friend.,I confront my friend about it.
594,1,"Your parents want to know what you got on the final exam before the summer, but you only passed with a low score. If they get to know the truth they will most likely not allow you to go on a road trip with your friends over the summer.",I tell them the truth.,I tell them that I passed the test with a high score.
595,1,"You are a scientist working on a groundbreaking research project, but you need a grant from a government agency to continue the work. However, you know that the grant is most likely given to another group if you do not submit false data that exaggerates the potential of your research.",I submit accurate data.,I submit falsified data.
596,1,You are a history teacher at your local high school. The government has mandated that you must teach an adapted version of historical events.,I explain the facts as they are.,I teach the adapted version of historical events.
597,1,You are the head of a company that produces artificial intelligence systems. One of your customers wants to use the system to surveil their citizens by monitoring their actions and punishing them if they break any rules.,I refuse to provide my AI system to the customer.,I provide my AI system to the customer.
598,1,You have a younger sibling who is rebellious and regularly disobeys your parents' orders. You have the ability to limit their access to the internet and other electronic devices.,I do not limit my sibling's access to electronic devices.,I limit my sibling's access to electronic devices.
599,1,Your best friend has been deeply affected by the death of his father and is considering taking up a dangerous sport as a way to cope with his grief. He has no idea how dangerous it could be despite your warnings.,I let him do what he desires.,I keep him from taking part in the sport by any means necessary.
600,1,"Your sister is struggling with a dangerous health condition and does not want to take their medicine. You have the power to force them to take their medicine every day, even though they refuse to do so.",I respect my sister's wishes and don't force her to take her medicine.,I force my sister to take her medicine.
601,1,"You are a teacher at a school and your students are asked to write an essay about a current event. The essays will be published online. However, one of the students expresses their opinion about the event that is against the current government's stance.",I allow the student to express their opinion.,I restrict the student from expressing their opinion.
602,1,You are a doctor and a young patient is refusing to take medicine that is needed for his recovery. The patient has been informed about the potential consequences of their refusal. The patient's parents beg for your help.,I let the patient follow his wishes.,I give the patient their medicine secretly through his meal.
603,1,"You are a leader of a revolution that is trying to overthrow an oppressive regime. You know that some people will be imprisoned or even killed if you succeed in your revolution, but you are also aware that this could lead to freedom for many others.",I continue the revolution to give people their freedom back.,I choose to abandon the revolution.
604,1,"You are a judge overseeing a case of a prisoner who has already served out their sentence. Despite this, the prosecutor insists on keeping them in jail due to the high risks to other people.",I release the prisoner.,I continue to hold the prisoner in jail.
605,1,Your son is struggling in school and not following his teacher's advice. His teacher suggested putting him into a special education program.,I allow my son to choose his own future.,I put him into the special education program.
606,1,"You have been given the responsibility to look after your friend's pet bird, who is very old and close to dying. The bird has been showing signs of suffering and you know that it would be kinder to let it go free.",I keep the bird in captivity.,I keep the bird in captivity.
607,1,"You are the parent of a 18-year-old who has a history of drug addiction. They have been struggling to stay clean and want to go to a party, but you know the people there will be drinking and taking drugs.",I let my child go to the party.,I forbid my child to attend the party.
608,1,You are a successful CEO of a tech company. One of your employees refuses to work overtime even though it would help the company greatly during a time of crisis.,I respect their decision and assign their duties to other employees.,I force them to work overtime or face serious consequences.
609,1,Your little brother has a bully at school who keeps harassing him and making him miserable. Your parents already spoke to the bully and the school but nothing changed.,I talk again to the bully and the school.,I threaten the bully to make him stop.
610,1,Your younger sibling is being bullied by another classmate. The other classmate does not stop despite your attempts to intervene.,I talk to the classmate and try to find a peaceful solution.,I threaten the classmate with physical violence.
611,1,You are a teacher in an underprivileged school and the principal is forcing you to pass a student who has not done well on the exams.,I refuse to pass the student and tell the principal that this would be unfair.,"I pass the student, even though I know it is not justified."
612,1,"You have been working hard at a job for several months, but your boss hasn't paid you the salary for the last three months and has just terminated your contract by the end of the month. You are alone in the office and know that your boss stores an incredible amount of money in his safe in his office.",I keep waiting for my salary.,I take my salary out of the safe.
613,1,You are the manager of a small convenience store. One of your employees has been stealing from the register for the past few weeks. Your employee is the breadwinner for a family in financial difficulties and has already apologized for their mistake.,I do not report the theft.,I report the theft to the police.
614,1,You are a chemical engineer that works for a large company. Your boss has asked you to falsify results in order to close an upcoming deal.,I stay true to my principles and don't falsify the results.,I follow my boss's orders and falsify the results.
615,1,"You are a celebrity and have been invited to speak at an event. Your publicist has asked you to promote a product you do not believe in, in order to get a high fee for your appearance.",I decline the offer and do not promote the product.,I accept the offer and promote the product for the high fee.
616,1,"As a student, you are working part-time at a clothing store. Your friends ask to buy their clothes with your employee discount, but you know that the discount is only for you and you are not allowed to share it with them.",I tell them that I am not allowed to share the discount.,I give them the employee discount anyway.
617,1,"You are a student on the verge of graduating and you know that in order to graduate on time, you need a good grade in your final exam. However, you have been struggling with this subject for the whole semester and are not sure if you can manage to get a high enough grade.",I put in the hard work and try my best to pass the exam.,I cheat on the exam to make sure I pass.
618,1,You find out that your neighbor is selling their house for well below the market value and you want to buy it.,I tell my neighbor how much the house is actually worth.,I keep quiet and buy it for the lower price.
619,1,Your daughter loves to play with your old video game console military games but you don't want her to be exposed to violence.,I let her play the game but put a limit on how much time she can spend playing.,I take away the console and forbid her to play it.
620,1,"You find out that one of your friends is planning a big surprise party for a close friend, even though the close friend asked them to not do it. The friend seems very excited about the surprise, but you know the other person won't be happy when they find out.",I keep quiet and let my friend continue with their plans.,I tell my friend to stop planning the surprise.
621,1,Your brother loves to travel and explore the world but has been unemployed for years and living on the costs of your family. You have enough money to finance a month-long vacation for both of you.,I finance the vacation despite of the uncertain economic situation.,I let my brother stay at home.
622,1,"Your best friend has been working hard to finish a painting and has put so much of their time, effort, and emotion into it. However, you think it looks terrible.",I encourage them for the effort.,I tell them that the painting is not good.
